mkdir ./{client,server}


cp client.py ./client/client.py
cp server.py ./server/server.py




docker compose up -d



docker exec -it tcp-server sh

apk add --no-cache tcpdump

tcpdump -n -i any tcp port 12345



/app # tcpdump -n -i any tcp port 12345
tcpdump: WARNING: any: That device doesn't support promiscuous mode
(Promiscuous mode not supported on the "any" device)
tcpdump: verbose output suppressed, use -v[v]... for full protocol decode
listening on any, link-type LINUX_SLL2 (Linux cooked v2), snapshot length 262144 bytes
05:24:13.072005 eth0  In  IP 192.168.0.2.48036 > 192.168.0.3.12345: Flags [.], ack 698509147, win 502, options [nop,nop,TS val 4059048501 ecr 201320706], length 0
05:24:13.072018 eth0  Out IP 192.168.0.3.12345 > 192.168.0.2.48036: Flags [.], ack 1, win 509, options [nop,nop,TS val 201330943 ecr 4058966464], length 0

05:24:23.312508 eth0  In  IP 192.168.0.2.48036 > 192.168.0.3.12345: Flags [.], ack 1, win 502, options [nop,nop,TS val 4059058741 ecr 201330943], length 0
05:24:23.312643 eth0  Out IP 192.168.0.3.12345 > 192.168.0.2.48036: Flags [.], ack 1, win 509, options [nop,nop,TS val 201341183 ecr 4058966464], length 0

05:24:33.552162 eth0  In  IP 192.168.0.2.48036 > 192.168.0.3.12345: Flags [.], ack 1, win 502, options [nop,nop,TS val 4059068981 ecr 201341183], length 0
05:24:33.552454 eth0  Out IP 192.168.0.3.12345 > 192.168.0.2.48036: Flags [.], ack 1, win 509, options [nop,nop,TS val 201351423 ecr 4058966464], length 0

05:24:43.793190 eth0  In  IP 192.168.0.2.48036 > 192.168.0.3.12345: Flags [.], ack 1, win 502, options [nop,nop,TS val 4059079221 ecr 201351423], length 0
05:24:43.793220 eth0  Out IP 192.168.0.3.12345 > 192.168.0.2.48036: Flags [.], ack 1, win 509, options [nop,nop,TS val 201361663 ecr 4058966464], length 0

05:24:54.035375 eth0  In  IP 192.168.0.2.48036 > 192.168.0.3.12345: Flags [.], ack 1, win 502, options [nop,nop,TS val 4059089462 ecr 201361663], length 0
05:24:54.035434 eth0  Out IP 192.168.0.3.12345 > 192.168.0.2.48036: Flags [.], ack 1, win 509, options [nop,nop,TS val 201371905 ecr 4058966464], length 0

05:25:04.273346 eth0  In  IP 192.168.0.2.48036 > 192.168.0.3.12345: Flags [.], ack 1, win 502, options [nop,nop,TS val 4059099701 ecr 201371905], length 0
05:25:04.273373 eth0  Out IP 192.168.0.3.12345 > 192.168.0.2.48036: Flags [.], ack 1, win 509, options [nop,nop,TS val 201382143 ecr 4058966464], length 0

05:25:14.517374 eth0  In  IP 192.168.0.2.48036 > 192.168.0.3.12345: Flags [.], ack 1, win 502, options [nop,nop,TS val 4059109946 ecr 201382143], length 0
05:25:14.517403 eth0  Out IP 192.168.0.3.12345 > 192.168.0.2.48036: Flags [.], ack 1, win 509, options [nop,nop,TS val 201392388 ecr 4058966464], length 0

05:25:24.752103 eth0  In  IP 192.168.0.2.48036 > 192.168.0.3.12345: Flags [.], ack 1, win 502, options [nop,nop,TS val 4059120181 ecr 201392388], length 0
05:25:24.752115 eth0  Out IP 192.168.0.3.12345 > 192.168.0.2.48036: Flags [.], ack 1, win 509, options [nop,nop,TS val 201402623 ecr 4058966464], length 0

05:25:34.991803 eth0  In  IP 192.168.0.2.48036 > 192.168.0.3.12345: Flags [.], ack 1, win 502, options [nop,nop,TS val 4059130421 ecr 201402623], length 0
05:25:34.991810 eth0  Out IP 192.168.0.3.12345 > 192.168.0.2.48036: Flags [.], ack 1, win 509, options [nop,nop,TS val 201412863 ecr 4058966464], length 0

05:25:45.233008 eth0  In  IP 192.168.0.2.48036 > 192.168.0.3.12345: Flags [.], ack 1, win 502, options [nop,nop,TS val 4059140661 ecr 201412863], length 0
05:25:45.233020 eth0  Out IP 192.168.0.3.12345 > 192.168.0.2.48036: Flags [.], ack 1, win 509, options [nop,nop,TS val 201423103 ecr 4058966464], length 0

05:25:55.473003 eth0  In  IP 192.168.0.2.48036 > 192.168.0.3.12345: Flags [.], ack 1, win 502, options [nop,nop,TS val 4059150901 ecr 201423103], length 0
05:25:55.473041 eth0  Out IP 192.168.0.3.12345 > 192.168.0.2.48036: Flags [.], ack 1, win 509, options [nop,nop,TS val 201433343 ecr 4058966464], length 0

05:26:05.713170 eth0  In  IP 192.168.0.2.48036 > 192.168.0.3.12345: Flags [.], ack 1, win 502, options [nop,nop,TS val 4059161141 ecr 201433343], length 0
05:26:05.713221 eth0  Out IP 192.168.0.3.12345 > 192.168.0.2.48036: Flags [.], ack 1, win 509, options [nop,nop,TS val 201443583 ecr 4058966464], length 0

05:26:15.953279 eth0  In  IP 192.168.0.2.48036 > 192.168.0.3.12345: Flags [.], ack 1, win 502, options [nop,nop,TS val 4059171381 ecr 201443583], length 0
05:26:15.953300 eth0  Out IP 192.168.0.3.12345 > 192.168.0.2.48036: Flags [.], ack 1, win 509, options [nop,nop,TS val 201453823 ecr 4058966464], length 0

05:26:26.193016 eth0  In  IP 192.168.0.2.48036 > 192.168.0.3.12345: Flags [.], ack 1, win 502, options [nop,nop,TS val 4059181621 ecr 201453823], length 0
05:26:26.193026 eth0  Out IP 192.168.0.3.12345 > 192.168.0.2.48036: Flags [.], ack 1, win 509, options [nop,nop,TS val 201464063 ecr 4058966464], length 0

05:26:36.432973 eth0  In  IP 192.168.0.2.48036 > 192.168.0.3.12345: Flags [.], ack 1, win 502, options [nop,nop,TS val 4059191861 ecr 201464063], length 0
05:26:36.433014 eth0  Out IP 192.168.0.3.12345 > 192.168.0.2.48036: Flags [.], ack 1, win 509, options [nop,nop,TS val 201474303 ecr 4058966464], length 0

05:26:46.679240 eth0  In  IP 192.168.0.2.48036 > 192.168.0.3.12345: Flags [.], ack 1, win 502, options [nop,nop,TS val 4059202106 ecr 201474303], length 0
05:26:46.679259 eth0  Out IP 192.168.0.3.12345 > 192.168.0.2.48036: Flags [.], ack 1, win 509, options [nop,nop,TS val 201484548 ecr 4058966464], length 0

05:26:56.917697 eth0  In  IP 192.168.0.2.48036 > 192.168.0.3.12345: Flags [.], ack 1, win 502, options [nop,nop,TS val 4059212344 ecr 201484548], length 0
05:26:56.918186 eth0  Out IP 192.168.0.3.12345 > 192.168.0.2.48036: Flags [.], ack 1, win 509, options [nop,nop,TS val 201494787 ecr 4058966464], length 0

05:27:07.154046 eth0  In  IP 192.168.0.2.48036 > 192.168.0.3.12345: Flags [.], ack 1, win 502, options [nop,nop,TS val 4059222581 ecr 201494787], length 0
05:27:07.154083 eth0  Out IP 192.168.0.3.12345 > 192.168.0.2.48036: Flags [.], ack 1, win 509, options [nop,nop,TS val 201505023 ecr 4058966464], length 0

05:27:17.393988 eth0  In  IP 192.168.0.2.48036 > 192.168.0.3.12345: Flags [.], ack 1, win 502, options [nop,nop,TS val 4059232821 ecr 201505023], length 0
05:27:17.393999 eth0  Out IP 192.168.0.3.12345 > 192.168.0.2.48036: Flags [.], ack 1, win 509, options [nop,nop,TS val 201515263 ecr 4058966464], length 0



05:27:27.634272 eth0  In  IP 192.168.0.2.48036 > 192.168.0.3.12345: Flags [.], ack 1, win 502, options [nop,nop,TS val 4059243061 ecr 201515263], length 0
05:27:27.634294 eth0  Out IP 192.168.0.3.12345 > 192.168.0.2.48036: Flags [.], ack 1, win 509, options [nop,nop,TS val 201525503 ecr 4058966464], length 0





05:27:37.874268 eth0  In  IP 192.168.0.2.48036 > 192.168.0.3.12345: Flags [.], ack 1, win 502, options [nop,nop,TS val 4059253301 ecr 201525503], length 0
05:27:37.874283 eth0  Out IP 192.168.0.3.12345 > 192.168.0.2.48036: Flags [.], ack 1, win 509, options [nop,nop,TS val 201535743 ecr 4058966464], length 0
